{
    "displayName": "Your Name Here!",
    "tagline": "Some unique tagline for yourself!",
    "profilePicture": "./private/images/Profile.png",
    "theme": "DarkMode",
    "linkTrayOnTop": true,
    "links": [
        {
            "linkName": "A web link!",
            "linkType": "web",
            "inLinkTray": false,
            "linkPosition": 1,
            "linkHref": "https://github.com/TrevorDBrown/LinkFreePlus",
            "newWindow": true,
            "hide": false
        },
        {
            "linkName": "A link in the Link Tray!",
            "linkType": "web",
            "inLinkTray": true,
            "linkPosition": 1,
            "linkHref": "https://example.com/",
            "newWindow": true,
            "hide": false
        },
        {
            "linkName": "A hidden link...",
            "linkType": "web",
            "inLinkTray": false,
            "linkPosition": 2,
            "linkHref": "https://www.youtube.com/watch?v=dQw4w9WgXcQ",
            "newWindow": true,
            "hide": true
        },
        {
            "linkName": "A link that is in the Link Tray that has a special icon!",
            "linkType": "home",
            "inLinkTray": true,
            "linkPosition": 2,
            "linkHref": "",
            "newWindow": true,
            "hide": false
        }
    ]
}
